{
  "$schema": "urn:voidtrace:schema:scenario:0.1.0",
  "kind": "voidtrace.scenario",
  "schemaVersion": "0.1.0",
  "id": "scenario.golden-expected-critical-armor",
  "revision": 0,
  "contentHash": "sha256:e11dc2fc6fa8000aa137c081cd45010f3c035526ed85d4d1325f86d6a4ac1dda",
  "gameBuild": "synthetic-fixture-0",
  "catalogRef": {
    "kind": "catalog-snapshot",
    "schemaVersion": "0.1.0",
    "id": "catalog.synthetic-tier-2",
    "revision": 0,
    "contentHash": "sha256:c0c7ea81d51f767079587f47d2a492ebac06960ca379c762eee416566ec4af87",
    "gameBuild": "synthetic-fixture-0"
  },
  "rulesetRef": {
    "kind": "ruleset",
    "schemaVersion": "0.4.0",
    "id": "ruleset.synthetic-core",
    "revision": 1,
    "contentHash": "sha256:731859a274f3bb7f914987e4fd561a62b2faa343787ccee3c0fb962d75bd4264",
    "gameBuild": "synthetic-fixture-0"
  },
  "attacker": {
    "id": "actor.attacker",
    "configuration": {
      "weaponId": "weapon.synthetic-aperture",
      "attackModeId": "attack-mode.synthetic-aperture.primary"
    }
  },
  "targets": [
    {
      "id": "actor.target",
      "configuration": {
        "catalogTargetId": "target.synthetic-calibration",
        "resolvedHealth": 125,
        "resolvedShield": 0,
        "resolvedArmor": 300,
        "resolvedOverguard": 0
      }
    }
  ],
  "initialState": {},
  "actionPlan": [
    {
      "id": "action.direct-hit-1",
      "kind": "action.direct-hit",
      "parameters": {
        "targetId": "actor.target",
        "hitLocation": "hit-location.neutral-body",
        "damageLayer": "health"
      }
    }
  ],
  "simulation": {
    "mode": "expected",
    "timeLimitMs": 1
  },
  "metrics": [
    "damage.direct-hit.total",
    "critical.base-tier",
    "critical.next-tier",
    "critical.fraction",
    "critical.base-tier.probability",
    "critical.next-tier.probability",
    "critical.tier-0.probability",
    "critical.tier-1.probability",
    "critical.expected.multiplier",
    "damage.expected.post-critical.total",
    "armor.remaining-multiplier",
    "damage.expected.health.total",
    "target.health.expected-remaining"
  ],
  "assumptions": [
    {
      "id": "assumption.synthetic-expected-critical-armor",
      "description": "Synthetic expected-value fixture; not a verified current-game Warframe claim."
    }
  ]
}
