{
  "$schema": "urn:voidtrace:schema:scenario:0.1.0",
  "kind": "voidtrace.scenario",
  "schemaVersion": "0.1.0",
  "id": "scenario.golden-radial-critical-armor",
  "revision": 0,
  "contentHash": "sha256:e521bb8a306b2e7ebedb43c8064399f533e5f7b518a0e91609fc05f2d4c49582",
  "gameBuild": "synthetic-fixture-0",
  "catalogRef": {
    "kind": "catalog-snapshot",
    "schemaVersion": "0.1.0",
    "id": "catalog.synthetic-mini",
    "revision": 0,
    "contentHash": "sha256:d8136a7f9a2f20899fb89001409dc3f71a1010dd1a7002b67f9917f2d3d61224",
    "gameBuild": "synthetic-fixture-0"
  },
  "rulesetRef": {
    "kind": "ruleset",
    "schemaVersion": "0.7.0",
    "id": "ruleset.synthetic-core",
    "revision": 1,
    "contentHash": "sha256:4cfce29bce7ff17900e4e06d7e2694adecc468094ab46f5056db7b63eeb67bf2",
    "gameBuild": "synthetic-fixture-0"
  },
  "attacker": {
    "id": "actor.attacker",
    "configuration": {
      "weaponId": "weapon.synthetic-aperture",
      "attackModeId": "attack-mode.synthetic-aperture.primary"
    }
  },
  "targets": [
    {
      "id": "actor.target",
      "configuration": {
        "catalogTargetId": "target.synthetic-calibration",
        "resolvedHealth": 1000,
        "resolvedShield": 0,
        "resolvedArmor": 300,
        "resolvedOverguard": 0
      }
    }
  ],
  "initialState": {},
  "actionPlan": [
    {
      "id": "action.radial-hit-1",
      "kind": "action.radial-hit",
      "parameters": {
        "targetId": "actor.target",
        "hitLocation": "hit-location.neutral-body",
        "damageLayer": "health",
        "criticalTier": 1,
        "resolvedFalloffMultiplier": 0.75
      }
    }
  ],
  "simulation": {
    "mode": "deterministic",
    "timeLimitMs": 1
  },
  "metrics": [
    "damage.radial.base.total",
    "critical.tier",
    "critical.multiplier",
    "damage.post-critical.total",
    "radial.falloff.multiplier",
    "damage.radial.total",
    "armor.remaining-multiplier",
    "damage.health.total",
    "target.health.remaining"
  ],
  "assumptions": [
    {
      "id": "assumption.synthetic-radial",
      "description": "Synthetic standalone Radial Hit with resolved falloff input; not a verified current-game Warframe claim."
    },
    {
      "id": "assumption.resolved-radial-falloff",
      "description": "The fixture supplies falloff 0.75 directly and does not evaluate distance, geometry, a Direct sibling, or a Projectile parent."
    }
  ]
}
