{
  "$schema": "urn:voidtrace:schema:scenario:0.1.0",
  "kind": "voidtrace.scenario",
  "schemaVersion": "0.1.0",
  "id": "scenario.golden-multishot-critical-armor",
  "revision": 0,
  "contentHash": "sha256:f14cf063c7508c380ee21d47afc6befa916db213598a10c49637013b9ad27927",
  "gameBuild": "synthetic-fixture-0",
  "catalogRef": {
    "kind": "catalog-snapshot",
    "schemaVersion": "0.1.0",
    "id": "catalog.synthetic-mini",
    "revision": 0,
    "contentHash": "sha256:d8136a7f9a2f20899fb89001409dc3f71a1010dd1a7002b67f9917f2d3d61224",
    "gameBuild": "synthetic-fixture-0"
  },
  "rulesetRef": {
    "kind": "ruleset",
    "schemaVersion": "0.6.0",
    "id": "ruleset.synthetic-core",
    "revision": 1,
    "contentHash": "sha256:e66d73f7b47f365bebc7f4bf888fb1e3c804cc7094d179b53788a9ae697b7fb3",
    "gameBuild": "synthetic-fixture-0"
  },
  "attacker": {
    "id": "actor.attacker",
    "configuration": {
      "weaponId": "weapon.synthetic-aperture",
      "attackModeId": "attack-mode.synthetic-aperture.primary"
    }
  },
  "targets": [
    {
      "id": "actor.target",
      "configuration": {
        "catalogTargetId": "target.synthetic-calibration",
        "resolvedHealth": 250,
        "resolvedShield": 0,
        "resolvedArmor": 300,
        "resolvedOverguard": 0
      }
    }
  ],
  "initialState": {},
  "actionPlan": [
    {
      "id": "action.multishot-1",
      "kind": "action.multishot-direct-hit",
      "parameters": {
        "targetId": "actor.target",
        "hitLocation": "hit-location.neutral-body",
        "damageLayer": "health",
        "criticalTier": 1,
        "hitCount": 3
      }
    }
  ],
  "simulation": {
    "mode": "deterministic",
    "timeLimitMs": 1
  },
  "metrics": [
    "multishot.hit-count",
    "damage.direct-hit.total",
    "critical.tier",
    "critical.multiplier",
    "damage.post-critical.total",
    "armor.remaining-multiplier",
    "damage.health.total",
    "damage.multishot.total",
    "target.health.remaining"
  ],
  "assumptions": [
    {
      "id": "assumption.synthetic-multishot",
      "description": "Synthetic resolved fixed-count Multishot fixture; not a verified current-game Warframe claim."
    },
    {
      "id": "assumption.fixed-critical-tier",
      "description": "Every emitted hit uses the same explicit fixed Critical tier; no Critical or Multishot roll is generated."
    }
  ]
}
